{"format":"stateowl.r4-handoff/1","protocol":"stateowl/0.2-draft.3","profile":{"id":"stateowl.r4-continuity/1","digest":"sha256:9558ad87b903f8c86da55320af7798eadc48ba794cef020f0b587c679937c75c"},"target":{"kind":"git","authority":"github.com","resource":"repla73/stateowl-r4-qualification","namespace":"refs/heads/stateowl-r4-qualification"},"at":{"snapshot":{"id":"git:sha1:1111111111111111111111111111111111111111"}},"records":[{"key":"task","path":"state/task.json","format":"json"},{"key":"work","path":"state/work.json","format":"json"}],"continuation":null}
