{"format":"stateowl.r4-handoff/1","protocol":"stateowl/0.2-draft.3","profile":{"id":"stateowl.r4-continuity/1","digest":"sha256:9558ad87b903f8c86da55320af7798eadc48ba794cef020f0b587c679937c75c"},"target":{"kind":"git","authority":"github.com","resource":"repla73/stateowl-r4-qualification","namespace":"refs/heads/stateowl-r4-qualification"},"at":{"snapshot":{"id":"git:sha1:1111111111111111111111111111111111111111"}},"records":[{"key":"task","path":"state/task.json","format":"json"},{"key":"work","path":"state/work.json","format":"json"}],"continuation":{"kind":"publication","request":{"protocol":"stateowl/0.2-draft.3","op":"publish","target":{"kind":"git","authority":"github.com","resource":"repla73/stateowl-r4-qualification","namespace":"refs/heads/stateowl-r4-qualification"},"expected":{"id":"git:sha1:1111111111111111111111111111111111111111"},"mode":"reconcile","validation":null,"changes":[{"path":"state/work.json","put":{"encoding":"utf8","data":"{\"step\":1}\n"}}]},"request_digest":"sha256:4874c28faa0a1bef11a6bcaa3edf48a112fdd4571ef72931b92e4d5c4d935565","prior_result":{"protocol":"stateowl/0.2-draft.3","op":"publish","outcome":"indeterminate","request_digest":"sha256:4874c28faa0a1bef11a6bcaa3edf48a112fdd4571ef72931b92e4d5c4d935565","error":{"code":"PROVIDER_UNAVAILABLE","retry":"reconcile"}}}}
